{
  "schema": "mbos.discovery.freeze_request/1",
  "level": "L2",
  "capability": "discovery.source.ebay.read",
  "source": "ebay",
  "reason": "rate_limited (status 429) x2 — stop; no evasion; human must clear",
  "requested_at": "2026-10-07T12:00:00Z",
  "requested_by": "agent-02-opportunity",
  "evidence": { "kind": "rate_limited", "status": 429, "consecutive_blocks": 2 }
}
